{
  "slug": "fascia-emotion",
  "title": "Fascia-directed interventions and emotional / psychological outcomes in humans",
  "question": "In humans, do interventions that explicitly target the fascial / connective-tissue system (e.g. myofascial release, fascial manipulation, connective-tissue manipulation, structural integration) change emotional states, affect regulation, or psychological outcomes (anxiety, stress, depression, trauma), as measured by validated psychological instruments or physiological affect markers?",
  "pico": {
    "population": "Human participants of any age, healthy or clinical (e.g. chronic pain, anxiety, PTSD, fibromyalgia)",
    "exposure": "An intervention explicitly framed as targeting fascia / myofascial / connective tissue (myofascial release or induction, fascial manipulation, connective-tissue manipulation/massage, structural integration/Rolfing, fascia-directed manual therapy)",
    "comparator": "Sham, no-treatment, waitlist, active control, or within-subject pre/post (single-arm allowed but flagged)",
    "outcome": "Emotional / psychological outcome measured with a validated psychological instrument (e.g. STAI, PSS, PHQ, BDI, PCL, POMS) or a physiological affect marker (cortisol, heart-rate variability, skin conductance)"
  },
  "inclusion_criteria": [
    "Human participants (any age; healthy or clinical population)",
    "Applies an intervention explicitly framed as targeting fascia / myofascial / connective tissue (not generic massage, exercise, or relaxation lacking a fascial rationale)",
    "Reports at least one emotional / psychological outcome measured with a validated psychological instrument or a physiological affect marker (cortisol, HRV, skin conductance)",
    "Primary study reporting original data: RCT, non-randomised trial, controlled or single-arm pre/post interventional, or experimental design",
    "English-language full text available"
  ],
  "exclusion_reasons": [
    "not-human",
    "no-fascia-intervention",
    "no-validated-psych-outcome",
    "not-interventional",
    "wrong-publication-type",
    "conference-abstract-only",
    "not-english",
    "no-primary-data",
    "duplicate"
  ],
  "extraction_profile": {
    "arm_noun": "intervention arm",
    "summary_field": "effect_direction",
    "fields": [
      {
        "key": "design",
        "label": "Study design",
        "required": true,
        "help": "RCT, non-randomised trial, controlled pre/post, single-arm pre/post, crossover"
      },
      {
        "key": "population",
        "label": "Population",
        "required": true,
        "help": "healthy volunteers, or clinical group (e.g. chronic low-back pain, fibromyalgia, anxiety); include n"
      },
      {
        "key": "intervention",
        "label": "Fascia intervention",
        "required": true,
        "help": "the fascia-directed technique as named by the study (e.g. myofascial release, structural integration)"
      },
      {
        "key": "comparator",
        "label": "Comparator",
        "required": false,
        "help": "sham, waitlist, active control, or none (single-arm)"
      },
      {
        "key": "outcome_measure",
        "label": "Outcome measure(s)",
        "required": true,
        "help": "the validated instrument(s) or physiological marker(s) reported"
      },
      {
        "key": "result",
        "label": "Result",
        "required": true,
        "help": "quote the study's own numbers / effect sizes / p-values for the affect outcome"
      },
      {
        "key": "effect_direction",
        "label": "Effect on affect",
        "required": true,
        "categorical": {
          "values": {
            "improved": {
              "label": "Improved (reduced distress / better affect)",
              "tone": "positive"
            },
            "worsened": {
              "label": "Worsened",
              "tone": "negative"
            },
            "no-effect": {
              "label": "No measurable effect",
              "tone": "neutral"
            },
            "mixed": {
              "label": "Mixed across measures",
              "tone": "warn"
            },
            "unclear": {
              "label": "Unclear / not interpretable",
              "tone": "accent"
            }
          }
        }
      },
      {
        "key": "notes",
        "label": "Notes",
        "required": false,
        "in_table": false,
        "help": "dose/sessions, blinding, dropouts, caveats, physiological vs self-report divergence"
      }
    ]
  },
  "searches": [
    {
      "database": "PubMed",
      "query": "(\"myofascial release\" OR \"myofascial induction\" OR \"fascial manipulation\" OR \"connective tissue manipulation\" OR \"connective tissue massage\" OR \"structural integration\" OR \"fascial release\" OR \"fascia-directed\") AND (anxiety OR stress OR depression OR mood OR affect OR emotional OR emotion OR psychological OR distress OR wellbeing OR \"well-being\")",
      "date": "2026-07-07",
      "count": 355,
      "note": "label=broad; fetched=355; added=350"
    },
    {
      "database": "PubMed",
      "query": "(\"myofascial release\" OR \"myofascial induction\" OR \"fascial manipulation\" OR \"connective tissue manipulation\" OR \"connective tissue massage\" OR \"structural integration\" OR \"fascial\" OR \"myofascial therapy\") AND (cortisol OR \"heart rate variability\" OR \"skin conductance\" OR \"autonomic\" OR \"parasympathetic\" OR \"salivary\" OR \"vagal\")",
      "date": "2026-07-07",
      "count": 181,
      "note": "label=physio-markers; fetched=181; added=159"
    },
    {
      "database": "PubMed",
      "query": "(Rolfing OR \"structural integration\" OR \"myofascial induction\" OR \"Bowen technique\" OR \"Bowen therapy\" OR \"fascial manipulation\" OR \"fascia\" OR \"myofascial\") AND (anxiety OR stress OR depression OR mood OR \"quality of life\" OR psychological OR \"mental health\" OR trauma OR PTSD OR wellbeing)",
      "date": "2026-07-07",
      "count": 16967,
      "note": "label=named-modalities; fetched=500; added=466"
    },
    {
      "database": "PubMed",
      "query": "(Rolfing OR \"structural integration\" OR \"Bowen technique\" OR \"Bowen therapy\" OR \"fascial manipulation\" OR \"myofascial induction\" OR \"myofascial release\" OR \"fascial unwinding\") AND (anxiety OR stress OR depression OR mood OR affect OR emotion OR psychological OR \"mental health\" OR trauma OR PTSD OR wellbeing OR \"quality of life\")",
      "date": "2026-07-07",
      "count": 8339,
      "note": "label=named-modalities-tight; fetched=500; added=287"
    }
  ]
}